{
  "$schema": "http://json-schema.org/draft-07/schema#",
  "$id": "bar-chart-schema",
  "title": "Bar Chart Schema",
  "description": "Intermediate representation for bar chart diagrams. LLM extracts data from natural language into this format, then rendering pipeline generates HTML/SVG from it.",
  "type": "object",
  "required": ["diagramType", "title", "series"],
  "additionalProperties": false,
  "properties": {
    "diagramType": {
      "type": "string",
      "const": "bar",
      "description": "Identifies this JSON as a bar chart. Must always be 'bar'."
    },
    "title": {
      "type": "string",
      "maxLength": 200,
      "description": "Chart title, displayed at the top of the rendered page.",
      "examples": ["2025年各季度营收", "Monthly Active Users Comparison"]
    },
    "subtitle": {
      "type": "string",
      "maxLength": 300,
      "description": "Optional subtitle shown below the title, typically describing the unit or scope.",
      "examples": ["单位：万元", "Comparison across product lines"]
    },
    "style": {
      "$ref": "#/$defs/styleEnum",
      "description": "Visual style preset. Each style has its own template and design rules.",
      "default": "dark-professional"
    },
    "format": {
      "$ref": "#/$defs/formatEnum",
      "description": "Output format. HTML is the default (single-file with inline SVG and CSS). SVG outputs standalone SVG. Mermaid uses xychart-beta syntax (experimental).",
      "default": "html"
    },
    "density": {
      "type": "string",
      "enum": ["compact", "normal", "spacious"],
      "description": "Layout density. compact=tighter spacing; normal=standard; spacious=generous spacing.",
      "default": "normal"
    },
    "direction": {
      "type": "string",
      "enum": ["vertical", "horizontal"],
      "description": "Bar orientation. vertical=bars grow upward (default). horizontal=bars grow rightward.",
      "default": "vertical"
    },
    "variant": {
      "type": "string",
      "enum": ["grouped", "stacked"],
      "description": "Multi-series arrangement. grouped=bars side by side (default). stacked=bars on top of each other.",
      "default": "grouped"
    },
    "series": {
      "type": "array",
      "description": "Data series. Each series contains data points with labels and values. Multiple series are displayed as grouped or stacked bars.",
      "items": {
        "$ref": "#/$defs/seriesItem"
      },
      "minItems": 1,
      "maxItems": 8
    },
    "axis": {
      "type": "object",
      "description": "Axis configuration for both X and Y axes.",
      "additionalProperties": false,
      "properties": {
        "x": {
          "$ref": "#/$defs/axisConfig",
          "description": "X-axis configuration (category axis)."
        },
        "y": {
          "$ref": "#/$defs/axisConfig",
          "description": "Y-axis configuration (value axis)."
        }
      }
    },
    "legend": {
      "$ref": "#/$defs/legendConfig",
      "description": "Legend configuration. Auto-generated from series names if not provided."
    },
    "colors": {
      "$ref": "#/$defs/colorsOverride",
      "description": "Optional color overrides for the style's environment colors (background, text, etc.). Does NOT affect data bar colors — use series[].color for that."
    },
    "metadata": {
      "$ref": "#/$defs/metadata",
      "description": "Optional metadata. author field is for internal tracking only and MUST NOT be rendered into the output."
    }
  },
  "$defs": {
    "styleEnum": {
      "type": "string",
      "enum": [
        "dark-professional",
        "hand-drawn",
        "light-corporate",
        "cyberpunk-neon",
        "blueprint",
        "warm-cozy",
        "minimalist",
        "terminal-retro",
        "pastel-dream",
        "notion",
        "material",
        "glassmorphism"
      ],
      "description": "Visual style preset names."
    },
    "formatEnum": {
      "type": "string",
      "enum": ["html", "svg", "mermaid"],
      "description": "Output format."
    },
    "legendConfig": {
      "type": "object",
      "additionalProperties": false,
      "description": "Legend display configuration.",
      "properties": {
        "visible": {
          "type": "boolean",
          "description": "Whether to show the legend.",
          "default": true
        },
        "position": {
          "type": "string",
          "enum": ["top", "bottom", "left", "right"],
          "description": "Legend placement relative to the chart.",
          "default": "top"
        }
      }
    },
    "colorsOverride": {
      "type": "object",
      "additionalProperties": false,
      "description": "Optional color overrides for style environment colors.",
      "properties": {
        "primary": {
          "type": "string",
          "pattern": "^#[0-9a-fA-F]{6}$",
          "description": "Primary accent color."
        },
        "secondary": {
          "type": "string",
          "pattern": "^#[0-9a-fA-F]{6}$",
          "description": "Secondary color."
        },
        "accent": {
          "type": "string",
          "pattern": "^#[0-9a-fA-F]{6}$",
          "description": "Accent color."
        },
        "background": {
          "type": "string",
          "pattern": "^#[0-9a-fA-F]{6}$",
          "description": "Page background color."
        },
        "text": {
          "type": "string",
          "pattern": "^#[0-9a-fA-F]{6}$",
          "description": "Primary text color."
        }
      }
    },
    "metadata": {
      "type": "object",
      "additionalProperties": false,
      "description": "Optional metadata for tracking. author MUST NOT be rendered into output.",
      "properties": {
        "author": {
          "type": "string",
          "maxLength": 100,
          "description": "Author name. For internal tracking only, never displayed in output."
        },
        "date": {
          "type": "string",
          "format": "date",
          "description": "Creation date."
        },
        "version": {
          "type": "string",
          "maxLength": 20,
          "description": "Document version."
        }
      }
    },
    "axisConfig": {
      "type": "object",
      "additionalProperties": false,
      "description": "Configuration for a single axis.",
      "properties": {
        "label": {
          "type": "string",
          "maxLength": 50,
          "description": "Axis title text displayed along the axis.",
          "examples": ["季度", "万元", "月份", "Users"]
        },
        "visible": {
          "type": "boolean",
          "description": "Whether to show the axis line and labels.",
          "default": true
        },
        "gridLines": {
          "type": "boolean",
          "description": "Whether to show grid lines along this axis.",
          "default": false
        },
        "minValue": {
          "type": "number",
          "description": "Optional manual minimum value for the axis. Overrides auto-calculated min."
        },
        "maxValue": {
          "type": "number",
          "description": "Optional manual maximum value for the axis. Overrides auto-calculated max."
        },
        "ticks": {
          "type": "array",
          "description": "Pre-computed tick values from the Nice Numbers algorithm (Step 1). Step 2 uses these directly for axis rendering.",
          "items": {
            "type": "number"
          },
          "minItems": 2,
          "maxItems": 10
        }
      }
    },
    "seriesItem": {
      "type": "object",
      "required": ["name", "data"],
      "additionalProperties": false,
      "description": "A data series containing named data points.",
      "properties": {
        "name": {
          "type": "string",
          "maxLength": 100,
          "description": "Series name displayed in the legend.",
          "examples": ["营收", "Users", "Revenue"]
        },
        "color": {
          "type": "string",
          "pattern": "^#[0-9a-fA-F]{6}$",
          "description": "Optional color override for all bars in this series. Must be 6-digit hex (#RRGGBB). If omitted, uses the chart palette."
        },
        "data": {
          "type": "array",
          "description": "Data points in this series. Each has a label and numeric value.",
          "items": {
            "$ref": "#/$defs/dataPoint"
          },
          "minItems": 2,
          "maxItems": 30
        }
      }
    },
    "dataPoint": {
      "type": "object",
      "required": ["label", "value"],
      "additionalProperties": false,
      "description": "A single data point with a category label and numeric value.",
      "properties": {
        "label": {
          "type": "string",
          "maxLength": 100,
          "description": "Category label displayed on the axis.",
          "examples": ["Q1", "January", "Product A"]
        },
        "value": {
          "type": "number",
          "minimum": -1000000000000000,
          "maximum": 1000000000000000,
          "description": "Numeric value. Supports negative values for comparison charts. Must be a finite number (no NaN or Infinity)."
        }
      }
    }
  }
}
